course_id,question_name,question_text,question_type,answer_a,answer_b,answer_c,answer_d,correct_answer,rationale,difficulty,core_category
RCFE-CETP-006,RCFE-CETP-006_Q001,"Before an RCFE admission date is confirmed, why should the administrator review appraisal information, physician documentation, and facility capability together?",multichoice,"The combined review shows whether identified needs can be matched with documented services before move-in.","It allows the facility to delay all records until after the resident arrives.","It replaces the need to communicate with the resident or responsible person.","It proves that every future change in condition can be managed without review.",A,"Admission decisions should be based on connected evidence showing resident needs, service capacity, and unresolved items before the facility accepts responsibility.",foundational,"Resident Admission, Retention, and Assessment Procedures"
RCFE-CETP-006,RCFE-CETP-006_Q002,"What does source control mean during admission screening?",multichoice,"Using only verbal family statements because they are easiest to collect.","Separating what was reported, observed, documented, and still pending so the record remains clear.","Discarding informal notes once the admission agreement is signed.","Treating every document as current even when dates or signatures are missing.",B,"Source control helps the administrator distinguish reliable records from pending or secondhand information during admission review.",foundational,"Resident Admission, Retention, and Assessment Procedures"
RCFE-CETP-006,RCFE-CETP-006_Q003,"Which needs and services plan statement gives staff the clearest direction?",multichoice,"Assist the resident when staff think help may be useful.","Monitor the resident and keep everyone comfortable.","Offer a meal cue at lunch and dinner; notify the administrator after two meal refusals in seven days.","Provide good care and update the plan later if someone asks.",C,"A staff-ready instruction identifies the service, timing, observation point, and notification threshold instead of relying on vague judgment.",foundational,"Resident Admission, Retention, and Assessment Procedures"
RCFE-CETP-006,RCFE-CETP-006_Q004,"Which learner submission would violate the course privacy standard?",multichoice,"A fictional memo using Sample Resident A.","A general description of a pending physician report.","A role label such as responsible person or outside provider.","A real resident name paired with a real facility incident.",D,"Course activities must use fictional or de-identified learning examples and must not include real resident, facility, staff, or protected information.",foundational,"Resident Admission, Retention, and Assessment Procedures"
RCFE-CETP-006,RCFE-CETP-006_Q005,"Which factor belongs in a facility capability review before admission?",multichoice,"Whether staffing, environment, training, and procedures can support the assessed needs.","Whether the room should be filled quickly to avoid vacancy.","Whether the family prefers fewer questions before move-in.","Whether the resident seems pleasant during a brief tour.",A,"Capability review considers operational ability to deliver documented services across shifts, not convenience or general impressions.",foundational,"Resident Admission, Retention, and Assessment Procedures"
RCFE-CETP-006,RCFE-CETP-006_Q006,"What does Draft / Pending CDSS/ACS Approval status require in Moodle?",multichoice,"The course may issue certificates as soon as learners pass the post-test.","The course must remain labeled as pending and certificate release must stay blocked until approval metadata and evidence gates are satisfied.","The instructor may remove completion tracking while approval is pending.","The learner may count the course as approved credit before official metadata exists.",B,"Pending status requires clear labeling and certificate controls so Moodle does not imply approval or release credit prematurely.",foundational,"Resident Admission, Retention, and Assessment Procedures"
RCFE-CETP-006,RCFE-CETP-006_Q007,"Which documentation phrase best marks an unresolved admission item?",multichoice,"Everything appears fine.","Family says there are no concerns.","Physician report requested on the review date; admission decision remains pending until received and compared with appraisal findings.","No need to document this because it should arrive later.",C,"Pending items should be dated, named, and connected to the decision they affect so the admission record stays reviewable.",foundational,"Resident Admission, Retention, and Assessment Procedures"
RCFE-CETP-006,RCFE-CETP-006_Q008,"A responsible person disagrees with the facility's request for more pre-admission information. What is the best administrator response?",multichoice,"Accept the admission immediately to avoid conflict.","Tell staff to collect the information after move-in without recording the gap.","Ignore the disagreement because family communication is not part of admission screening.","Explain the needed information, document the pending item, and continue review through the approved process.",D,"Respectful communication and objective documentation help resolve admission gaps without bypassing required review.",foundational,"Resident Admission, Retention, and Assessment Procedures"
RCFE-CETP-006,RCFE-CETP-006_Q009,"Why should admission notes avoid personality labels?",multichoice,"Objective notes focus on observable facts, actions, notifications, pending items, and follow-up.","Personality labels are required for every admission record.","Labels make it easier to skip the needs and services plan.","Subjective wording eliminates the need for reappraisal.",A,"Objective language supports continuity, dignity, and compliance review because later readers can see facts rather than assumptions.",foundational,"Resident Admission, Retention, and Assessment Procedures"
RCFE-CETP-006,RCFE-CETP-006_Q010,"What does admission-agreement linkage require?",multichoice,"The admission agreement should be kept separate from assessed needs.","The services and expectations in the agreement should align with the facility's documented ability to meet assessed needs.","The agreement should promise that the resident's condition will not change.","The agreement can be completed before any appraisal-related information is reviewed.",B,"The admission agreement should not stand apart from appraisal findings and service capability; it should reflect a supportable admission decision.",foundational,"Resident Admission, Retention, and Assessment Procedures"
RCFE-CETP-006,RCFE-CETP-006_Q011,"Staff report that the current plan says only 'assist as needed' after repeated evening confusion. Which revision best improves the plan?",multichoice,"Continue using the same phrase because it gives staff flexibility.","Delete staff notes until the resident asks for more help.","Provide an evening orientation cue at 7 p.m.; document response; notify the administrator after three episodes in one week.","Tell family that staff will handle it without further review.",C,"The revised instruction links the observed pattern to a specific action, documentation expectation, and notification threshold.",application,"Resident Admission, Retention, and Assessment Procedures"
RCFE-CETP-006,RCFE-CETP-006_Q012,"A resident has two falls and new missed meals after admission. Which administrator action best reflects reappraisal discipline?",multichoice,"Wait for the annual review because the resident was already admitted.","Ask a caregiver to remember the concern without changing records.","Assume the family will call if the pattern becomes serious.","Review the record, identify the change pattern, update the plan if needed, and document follow-up.",D,"Repeated changes after admission should prompt record review and possible plan updates rather than informal monitoring alone.",application,"Resident Admission, Retention, and Assessment Procedures"
RCFE-CETP-006,RCFE-CETP-006_Q013,"A prospective resident declines to provide a requested document during screening. What should the administrator document?",multichoice,"The document requested, the refusal or delay, who was notified, the impact on admission review, and the next step.","Only that the resident was uncooperative.","Nothing, because declined documents cannot be mentioned.","A promise that admission will proceed regardless of missing information.",A,"A neutral note preserves dignity while explaining the missing record and its effect on the admission decision.",application,"Resident Admission, Retention, and Assessment Procedures"
RCFE-CETP-006,RCFE-CETP-006_Q014,"The physician report is received but conflicts with family statements about transfer assistance. What should happen before final admission approval?",multichoice,"Choose the version that makes admission easiest.","Clarify the conflict through approved channels, document the discrepancy, and compare the resolved information with facility capability.","Ignore the report because family statements are more recent.","Ask staff to solve the issue after move-in.",B,"Conflicting admission information must be resolved or clearly tracked before the facility relies on it for a fit decision.",application,"Resident Admission, Retention, and Assessment Procedures"
RCFE-CETP-006,RCFE-CETP-006_Q015,"A family requests immediate move-in, but the appraisal is incomplete. Which response best protects the process?",multichoice,"Schedule the move-in and complete the appraisal if time allows.","Tell the family the paperwork does not matter if the room is available.","Explain that the admission decision remains pending until required review is completed and documented.","Ask direct-care staff to make the admission decision.",C,"The administrator should maintain the admission workflow even when external pressure favors a faster move-in.",application,"Resident Admission, Retention, and Assessment Procedures"
RCFE-CETP-006,RCFE-CETP-006_Q016,"After a plan update, which follow-up entry is most useful for audit review?",multichoice,"Plan changed, no other details.","Resident is better now.","Staff know what to do.","Plan updated to add dinner cueing; staff notified on the review date; administrator will recheck meal records in seven days.",D,"Audit-ready follow-up names the change, notification, and review timeline so the record can be understood later.",application,"Resident Admission, Retention, and Assessment Procedures"
RCFE-CETP-006,RCFE-CETP-006_Q017,"A record audit shows the service plan has not been updated since admission despite three documented changes. What is the appropriate administrator priority?",multichoice,"Bring the plan current by reviewing the changes, updating instructions, documenting notifications, and setting follow-up.","Leave the plan unchanged because the resident has not complained.","Remove older notes so the file looks consistent.","Wait for a licensing visit to identify needed corrections.",A,"A plan that no longer matches the record should be corrected through review, updated instructions, and documented follow-up.",application,"Resident Admission, Retention, and Assessment Procedures"
RCFE-CETP-006,RCFE-CETP-006_Q018,"When does a retention concern require escalation beyond routine staff action?",multichoice,"Whenever a family asks a question about services.","When repeated facts suggest the resident's needs may exceed current facility capability or approved procedures.","Only after the resident has moved out.","Never, because retention decisions are informal.",B,"Escalation is appropriate when the issue exceeds routine instructions and requires leadership, outside coordination, or higher-level review.",application,"Resident Admission, Retention, and Assessment Procedures"
RCFE-CETP-006,RCFE-CETP-006_Q019,"A resident prefers independence, but staff observe a new pattern of missed meals. Which documentation approach best preserves dignity and supports review?",multichoice,"Write that the resident is stubborn and refuses help.","Record only the family opinion and skip staff observations.","Document the observed pattern, the resident preference, the service offered, and the follow-up plan.","State that independence is no longer allowed.",C,"Balanced documentation can respect resident preference while still addressing objective changes that affect service planning.",application,"Resident Admission, Retention, and Assessment Procedures"
RCFE-CETP-006,RCFE-CETP-006_Q020,"Which Moodle evidence should support completion for this course?",multichoice,"A learner's verbal statement that the course was opened.","Only the final quiz score, even if activities are missing.","An email saying the learner intended to finish later.","Page views, scenario completions, participation response, assignment submission, quiz pass, evaluation, and completion gate audit.",D,"The filed course requires evidence across duration, activity completion, participation, assessment, evaluation, and certificate controls.",application,"Resident Admission, Retention, and Assessment Procedures"
RCFE-CETP-006,RCFE-CETP-006_Q021,"Scenario: Sample Resident E wants admission after a hospital stay, but the record lacks current mobility information. What should the administrator do?",multichoice,"Request and review current information, document the pending item, and determine whether facility services can meet the identified need.","Accept admission because the resident previously lived independently.","Assume the prior appraisal still answers all questions.","Promise the family that no additional review will be needed.",A,"Current mobility information affects admission fit, service planning, and staff instructions, so it must be reviewed before a supportable decision.",scenario,"Resident Admission, Retention, and Assessment Procedures"
RCFE-CETP-006,RCFE-CETP-006_Q022,"Scenario: Sample Resident F's plan lists reminders, but staff now report repeated exit-seeking attempts. Which response is most appropriate?",multichoice,"Tell staff to keep trying without changing the plan.","Open a reappraisal review, update immediate instructions, escalate according to policy, and document the pattern.","Delete the exit-seeking notes to avoid concern.","Wait until the family requests a meeting.",B,"A repeated exit-seeking pattern can indicate that the current plan no longer matches resident needs and requires structured review.",scenario,"Resident Admission, Retention, and Assessment Procedures"
RCFE-CETP-006,RCFE-CETP-006_Q023,"Scenario: Sample Resident G's responsible person says the resident eats well, but meal records show five missed dinners in ten days. What should the administrator rely on?",multichoice,"Only the responsible person's statement.","Only staff memory with no record review.","The documented pattern, follow-up communication, plan review, and any pending clarification.","A general belief that appetite changes are not an administrator concern.",C,"The administrator should reconcile reported information with documented patterns and update the plan when the record supports a trigger.",scenario,"Resident Admission, Retention, and Assessment Procedures"
RCFE-CETP-006,RCFE-CETP-006_Q024,"Scenario: Sample Resident H's family demands a final relocation decision during a tense phone call. What is the best administrator response?",multichoice,"Issue a final decision immediately to end the call.","Avoid documenting the call because it was tense.","Ask a caregiver to tell the family what will happen.","Document the concern, explain that review will follow approved channels, escalate as needed, and preserve respectful communication.",D,"Retention and relocation-related concerns should follow documented review and escalation rather than pressured decisions during conflict.",scenario,"Resident Admission, Retention, and Assessment Procedures"
RCFE-CETP-006,RCFE-CETP-006_Q025,"Scenario: Sample Resident I has a missing physician report and an incomplete pre-admission appraisal. Which admission note is strongest?",multichoice,"Admission review pending; physician report and appraisal completion requested; facility capability decision deferred until records are reviewed.","Resident seems fine, so move-in is approved.","Family wants admission soon, so missing records are not important.","Staff can decide what services are needed after move-in.",A,"The note clearly identifies pending records and links them to the admission decision instead of bypassing review.",scenario,"Resident Admission, Retention, and Assessment Procedures"
RCFE-CETP-006,RCFE-CETP-006_Q026,"Scenario: Sample Resident J has new nighttime disorientation. Staff have three different informal routines. What should the administrator do?",multichoice,"Allow each staff member to continue using personal preference.","Create a consistent plan instruction, document the trigger, notify staff, and set a review date.","Tell staff to stop documenting nighttime events.","Assume the condition is temporary and take no action.",B,"Inconsistent informal practice should be replaced with documented service instructions and follow-up tied to the observed change.",scenario,"Resident Admission, Retention, and Assessment Procedures"
RCFE-CETP-006,RCFE-CETP-006_Q027,"Scenario: Sample Resident K's file contains admission notes, incident notes, and family emails, but no clear follow-up timeline. What audit correction is most useful?",multichoice,"Remove family emails from the file.","Write that the administrator reviewed everything.","Add a dated follow-up plan that connects the trigger, action taken, responsible person notified, and next review date.","Wait until the next annual update.",C,"A clear follow-up timeline turns scattered records into a reviewable decision path.",scenario,"Resident Admission, Retention, and Assessment Procedures"
RCFE-CETP-006,RCFE-CETP-006_Q028,"Scenario: Sample Resident L's family asks the learner to use a real incident in the Moodle assignment. What should the learner do?",multichoice,"Use the incident because it will make the assignment realistic.","Include the resident name but omit the facility name.","Upload the real record as supporting evidence.","Convert the issue into a fictional example with no identifying details.",D,"The course requires fictional or de-identified work so Moodle submissions do not expose protected information.",scenario,"Resident Admission, Retention, and Assessment Procedures"
RCFE-CETP-006,RCFE-CETP-006_Q029,"Scenario: Sample Resident M has repeated staff notes that current supervision may not be enough. What should a retention review memo include?",multichoice,"Trigger pattern, records reviewed, current supports, capability concern, escalation path, and follow-up date.","Only the administrator's conclusion with no supporting facts.","A statement blaming the resident for needing more help.","A promise that no relocation discussion will ever occur.",A,"A retention review memo should organize the evidence and next steps without blame or unsupported guarantees.",scenario,"Resident Admission, Retention, and Assessment Procedures"
RCFE-CETP-006,RCFE-CETP-006_Q030,"Scenario: Sample Resident N's service-plan update is complete, but the post-test and evaluation are unfinished. What should Moodle show?",multichoice,"Course complete because the plan activity was submitted.","Incomplete until required activities, quiz pass, evaluation, and completion gate conditions are satisfied.","Certificate released because the learner spent time in the course.","No evidence needed if the instructor remembers the learner participating.",B,"Completion depends on all required course gates, not a single activity, and certificate controls remain tied to evidence and approval metadata.",scenario,"Resident Admission, Retention, and Assessment Procedures"
