question_id,lane,category,course_unit_module,objective,question_type,question_text,option_a,option_b,option_c,option_d,option_e,correct_answer,rationale,difficulty,source_reference,sme_review_status,moodle_import_category
RCFE-RCFE-CETP-007-Q02,RCFE,RCFE-CETP-007,RCFE-CETP-007 - Emergency Procedures and Physical Environment Controls (2h),Explain the purpose of drills.,mcq,Emergency drills in an RCFE are important because they:,Waste time,Help staff and residents respond effectively and reveal gaps to fix,Are only for new staff,Replace the written plan,,B,Drills build readiness and reveal gaps to correct.,easy,RCFE-CETP-007 LIC 9140 Course Packet,SME review recommended,RCFE/RCFE-CETP-007
RCFE-RCFE-CETP-007-Q03,RCFE,RCFE-CETP-007,RCFE-CETP-007 - Emergency Procedures and Physical Environment Controls (2h),Apply physical-environment safety.,mcq,"Maintaining clear, unobstructed exits and pathways primarily supports:",Decoration,Safe evacuation and fall prevention,Higher occupancy,Storage space,,B,Clear exits/pathways support safe evacuation and reduce falls.,easy,RCFE-CETP-007 LIC 9140 Course Packet,SME review recommended,RCFE/RCFE-CETP-007
RCFE-RCFE-CETP-007-Q04,RCFE,RCFE-CETP-007,RCFE-CETP-007 - Emergency Procedures and Physical Environment Controls (2h),Define staff emergency roles.,tf,Staff should know their roles and responsibilities during different types of emergencies.,TRUE,FALSE,,,,TRUE,Defined roles support a coordinated emergency response.,easy,RCFE-CETP-007 LIC 9140 Course Packet,SME review recommended,RCFE/RCFE-CETP-007
RCFE-RCFE-CETP-007-Q05,RCFE,RCFE-CETP-007,RCFE-CETP-007 - Emergency Procedures and Physical Environment Controls (2h),Maintain emergency supplies.,mcq,"Emergency supplies (water, food, first aid, etc.) should be:",Unnecessary,Maintained adequately and checked/replenished as needed,Stored where no one can reach them,Shared with neighbors routinely,,B,"Adequate, maintained emergency supplies support continuity during emergencies.",easy,RCFE-CETP-007 LIC 9140 Course Packet,SME review recommended,RCFE/RCFE-CETP-007
RCFE-RCFE-CETP-007-Q06,RCFE,RCFE-CETP-007,RCFE-CETP-007 - Emergency Procedures and Physical Environment Controls (2h),Plan for residents needing evacuation assistance.,mcq,"When considering residents with mobility or cognitive impairments in an evacuation, the plan should:",Treat all residents identically,Account for individual needs and assistance requirements,Exclude them,Assume they will self-evacuate,,B,Plans must account for residents needing assistance during evacuation.,medium,RCFE-CETP-007 LIC 9140 Course Packet,SME review recommended,RCFE/RCFE-CETP-007
RCFE-RCFE-CETP-007-Q07,RCFE,RCFE-CETP-007,RCFE-CETP-007 - Emergency Procedures and Physical Environment Controls (2h),Respond to a utility/heat emergency.,scenario,Scenario: A power outage occurs during extreme heat. The administrator should:,Wait and do nothing,"Activate the emergency plan, ensure resident safety and temperature/medical needs, communicate, and document actions",Send all staff home,Ignore residents needing cooling or refrigerated medications,,B,"Activate the plan, protect residents (heat/medication needs), communicate, and document.",hard,RCFE-CETP-007 LIC 9140 Course Packet,SME review recommended,RCFE/RCFE-CETP-007
RCFE-RCFE-CETP-007-Q08,RCFE,RCFE-CETP-007,RCFE-CETP-007 - Emergency Procedures and Physical Environment Controls (2h),Identify environmental safety measures.,ms,Which are part of physical-environment safety in an RCFE? (Select all that apply.),Functioning smoke detectors/alarms,"Clear, unobstructed exits",Blocked fire exits,Safe water temperature and hazard control,,A; B; D,"Working alarms, clear exits, and hazard control are correct; blocked exits are a hazard.",medium,RCFE-CETP-007 LIC 9140 Course Packet,SME review recommended,RCFE/RCFE-CETP-007
RCFE-RCFE-CETP-007-Q09,RCFE,RCFE-CETP-007,RCFE-CETP-007 - Emergency Procedures and Physical Environment Controls (2h),Apply drill documentation.,mcq,Documentation of emergency drills should include:,Nothing,"Date, type of drill, participants, and any issues/corrective actions",Only the weather,Staff opinions about lunch,,B,"Drill records should capture date, type, participation, and corrective actions.",medium,RCFE-CETP-007 LIC 9140 Course Packet,SME review recommended,RCFE/RCFE-CETP-007
RCFE-RCFE-CETP-007-Q10,RCFE,RCFE-CETP-007,RCFE-CETP-007 - Emergency Procedures and Physical Environment Controls (2h),Apply maintenance of safety equipment.,mcq,Routine inspection/maintenance of safety equipment helps to:,Increase risk,Ensure equipment works when needed and reduce hazards,Save documentation time,Replace drills,,B,Maintenance ensures safety equipment functions and reduces hazards.,easy,RCFE-CETP-007 LIC 9140 Course Packet,SME review recommended,RCFE/RCFE-CETP-007
RCFE-RCFE-CETP-007-Q11,RCFE,RCFE-CETP-007,RCFE-CETP-007 - Emergency Procedures and Physical Environment Controls (2h),Apply utility-shutoff preparedness.,tf,"Knowing how and when to shut off utilities (e.g., gas, water) can be part of emergency preparedness.",TRUE,FALSE,,,,TRUE,Utility shutoff knowledge supports certain emergency responses.,easy,RCFE-CETP-007 LIC 9140 Course Packet,SME review recommended,RCFE/RCFE-CETP-007
RCFE-RCFE-CETP-007-Q12,RCFE,RCFE-CETP-007,RCFE-CETP-007 - Emergency Procedures and Physical Environment Controls (2h),Apply after-action review.,mcq,"After an emergency, the administrator should:",Avoid review,"Review the response, document outcomes, and update the plan to address gaps",Blame residents,Discard records,,B,Post-event review and plan updates strengthen future readiness.,medium,RCFE-CETP-007 LIC 9140 Course Packet,SME review recommended,RCFE/RCFE-CETP-007
RCFE-RCFE-CETP-007-Q13,RCFE,RCFE-CETP-007,RCFE-CETP-007 - Emergency Procedures and Physical Environment Controls (2h),Apply emergency communication planning.,mcq,Communication during an emergency should include:,No communication,"A plan for notifying staff, residents, families, and authorities as appropriate",Only social media,Rumors,,B,"A communication plan covers staff, residents, families, and authorities.",medium,RCFE-CETP-007 LIC 9140 Course Packet,SME review recommended,RCFE/RCFE-CETP-007
RCFE-RCFE-CETP-007-Q14,RCFE,RCFE-CETP-007,RCFE-CETP-007 - Emergency Procedures and Physical Environment Controls (2h),Explain the purpose of environmental safety.,mcq,A safe physical environment supports residents primarily by:,Increasing hazards,"Reducing the risk of injury, supporting mobility, and enabling effective emergency response",Limiting resident rights,Cutting staffing,,B,A safe environment reduces injury risk and supports emergency response.,easy,RCFE-CETP-007 LIC 9140 Course Packet,SME review recommended,RCFE/RCFE-CETP-007
RCFE-RCFE-CETP-007-Q15,RCFE,RCFE-CETP-007,RCFE-CETP-007 - Emergency Procedures and Physical Environment Controls (2h),State the course purpose.,mcq,The overall purpose of this course is to:,Provide nursing certification,Strengthen emergency preparedness and physical-environment safety/controls in the RCFE,Replace licensing,Eliminate drills,,B,The purpose is emergency preparedness and environmental safety.,easy,RCFE-CETP-007 LIC 9140 Course Packet,SME review recommended,RCFE/RCFE-CETP-007
RCFE-RCFE-CETP-008-Q01,RCFE,RCFE-CETP-008,"RCFE-CETP-008 - Staff Supervision, Training Records, Administrator Accountability (2h)",Define the purpose of staff supervision.,mcq,Effective staff supervision in an RCFE primarily aims to:,Micromanage every action,"Ensure staff perform competently, safely, and consistently with policy and regulation",Reduce resident care,Avoid documentation,,B,"Supervision ensures competent, safe, policy-aligned performance.",easy,RCFE-CETP-008 LIC 9140 Course Packet,SME review recommended,RCFE/RCFE-CETP-008
RCFE-RCFE-CETP-008-Q02,RCFE,RCFE-CETP-008,"RCFE-CETP-008 - Staff Supervision, Training Records, Administrator Accountability (2h)",Apply training-record standards.,mcq,Staff training records should be:,Optional,"Maintained, accurate, and demonstrate required training was completed",Discarded after hiring,Kept off-site only,,B,Accurate training records demonstrate compliance with training requirements.,medium,RCFE-CETP-008 LIC 9140 Course Packet,SME review recommended,RCFE/RCFE-CETP-008
RCFE-RCFE-CETP-008-Q03,RCFE,RCFE-CETP-008,"RCFE-CETP-008 - Staff Supervision, Training Records, Administrator Accountability (2h)",Describe administrator accountability.,mcq,Administrator accountability means the administrator is responsible for:,Only marketing,"Overall facility operations, compliance, staff oversight, and resident well-being",Nothing once staff are hired,Only finances,,B,"The administrator is accountable for operations, compliance, oversight, and resident well-being.",easy,RCFE-CETP-008 LIC 9140 Course Packet,SME review recommended,RCFE/RCFE-CETP-008
RCFE-RCFE-CETP-008-Q04,RCFE,RCFE-CETP-008,"RCFE-CETP-008 - Staff Supervision, Training Records, Administrator Accountability (2h)",Apply onboarding training requirements.,tf,"New staff should receive orientation and required training before or promptly upon assuming their duties, per regulation.",TRUE,FALSE,,,,TRUE,Orientation/training requirements protect residents; confirm exact timelines with SME/legal.,medium,RCFE-CETP-008 LIC 9140 Course Packet,SME/legal review required before submission,RCFE/RCFE-CETP-008
RCFE-RCFE-CETP-008-Q05,RCFE,RCFE-CETP-008,"RCFE-CETP-008 - Staff Supervision, Training Records, Administrator Accountability (2h)",Explain the value of continuing training.,mcq,Ongoing (continuing) staff training is important because it:,Is never required,Maintains competency and keeps staff current with practices and regulations,Only benefits the administrator,Replaces supervision,,B,Continuing training maintains competency and currency.,easy,RCFE-CETP-008 LIC 9140 Course Packet,SME review recommended,RCFE/RCFE-CETP-008
RCFE-RCFE-CETP-008-Q06,RCFE,RCFE-CETP-008,"RCFE-CETP-008 - Staff Supervision, Training Records, Administrator Accountability (2h)",Apply corrective supervision.,mcq,"When a staff member performs a task incorrectly, an accountable supervisory response is to:",Ignore it,"Provide corrective feedback/retraining, document it, and monitor improvement",Publicly humiliate the staff member,Immediately terminate without process,,B,"Corrective feedback, retraining, documentation, and monitoring are constructive and defensible.",medium,RCFE-CETP-008 LIC 9140 Course Packet,SME review recommended,RCFE/RCFE-CETP-008
RCFE-RCFE-CETP-008-Q07,RCFE,RCFE-CETP-008,"RCFE-CETP-008 - Staff Supervision, Training Records, Administrator Accountability (2h)",Address training-documentation gaps.,scenario,Scenario: A licensing review finds gaps in staff training documentation. The administrator should:,Falsify records to fill gaps,"Identify the gaps, complete/verify required training, accurately document it, and implement a tracking system to prevent recurrence",Blame staff and do nothing,Hide the records,,B,"Honest correction, completion of training, accurate documentation, and a tracking system are correct; falsification is prohibited.",hard,RCFE-CETP-008 LIC 9140 Course Packet,SME review recommended,RCFE/RCFE-CETP-008
RCFE-RCFE-CETP-008-Q08,RCFE,RCFE-CETP-008,"RCFE-CETP-008 - Staff Supervision, Training Records, Administrator Accountability (2h)",Identify staff-management responsibilities.,ms,Which are administrator responsibilities for staff management? (Select all that apply.),Ensuring required training is completed,Maintaining accurate personnel/training records,Allowing untrained staff to perform tasks beyond their preparation,Supervising and supporting staff performance,,A; B; D,"Training, records, and supervision are responsibilities; allowing unprepared staff to perform tasks is not.",medium,RCFE-CETP-008 LIC 9140 Course Packet,SME review recommended,RCFE/RCFE-CETP-008
RCFE-RCFE-CETP-008-Q09,RCFE,RCFE-CETP-008,"RCFE-CETP-008 - Staff Supervision, Training Records, Administrator Accountability (2h)",Explain the importance of adequate staffing.,mcq,Adequate staffing levels are important because they:,Are irrelevant to care,"Support resident safety, needs, and quality of care",Only affect costs,Reduce accountability,,B,Adequate staffing supports safety and quality of care.,easy,RCFE-CETP-008 LIC 9140 Course Packet,SME review recommended,RCFE/RCFE-CETP-008
RCFE-RCFE-CETP-008-Q10,RCFE,RCFE-CETP-008,"RCFE-CETP-008 - Staff Supervision, Training Records, Administrator Accountability (2h)",Explain the purpose of staff screening.,mcq,Background screening/clearance requirements for staff exist to:,Slow hiring for no reason,Protect residents from individuals who may pose a risk,Increase paperwork only,Replace training,,B,Screening helps protect residents; confirm specific clearance requirements with SME/legal.,medium,RCFE-CETP-008 LIC 9140 Course Packet,SME/legal review required before submission,RCFE/RCFE-CETP-008
RCFE-RCFE-CETP-008-Q11,RCFE,RCFE-CETP-008,"RCFE-CETP-008 - Staff Supervision, Training Records, Administrator Accountability (2h)",Apply delegation vs. accountability.,tf,An administrator can delegate tasks but remains accountable for the facility's compliance and operations.,TRUE,FALSE,,,,TRUE,Delegation does not remove the administrator's overall accountability.,medium,RCFE-CETP-008 LIC 9140 Course Packet,SME review recommended,RCFE/RCFE-CETP-008
RCFE-RCFE-CETP-008-Q12,RCFE,RCFE-CETP-008,"RCFE-CETP-008 - Staff Supervision, Training Records, Administrator Accountability (2h)",Apply role clarity.,mcq,Clear job descriptions and expectations help staff to:,Be confused,"Understand their roles, responsibilities, and limits",Avoid accountability,Skip training,,B,Clear roles support performance and accountability.,easy,RCFE-CETP-008 LIC 9140 Course Packet,SME review recommended,RCFE/RCFE-CETP-008
RCFE-RCFE-CETP-008-Q13,RCFE,RCFE-CETP-008,"RCFE-CETP-008 - Staff Supervision, Training Records, Administrator Accountability (2h)",Describe supportive supervision.,mcq,A supportive supervision approach includes:,Only criticism,"Clear expectations, training, feedback, and recognition",No communication,Inconsistent rules,,B,"Effective supervision blends expectations, training, feedback, and recognition.",easy,RCFE-CETP-008 LIC 9140 Course Packet,SME review recommended,RCFE/RCFE-CETP-008
RCFE-RCFE-CETP-008-Q14,RCFE,RCFE-CETP-008,"RCFE-CETP-008 - Staff Supervision, Training Records, Administrator Accountability (2h)",Apply training tracking.,mcq,Tracking training due dates and renewals helps the administrator to:,Miss requirements,Stay compliant and ensure staff competencies are current,Avoid documentation,Reduce safety,,B,Tracking supports timely compliance and current competencies.,easy,RCFE-CETP-008 LIC 9140 Course Packet,SME review recommended,RCFE/RCFE-CETP-008
RCFE-RCFE-CETP-008-Q15,RCFE,RCFE-CETP-008,"RCFE-CETP-008 - Staff Supervision, Training Records, Administrator Accountability (2h)",State the course purpose.,mcq,The overall purpose of this course is to:,Provide clinical certification,"Strengthen staff supervision, training-record management, and administrator accountability",Replace licensing,Eliminate staffing,,B,"The purpose is supervision, training records, and accountability.",easy,RCFE-CETP-008 LIC 9140 Course Packet,SME review recommended,RCFE/RCFE-CETP-008
RCFE-RCFE-CETP-009-Q01,RCFE,RCFE-CETP-009,"RCFE-CETP-009 - Business Operations, Records, Claim-Safe Communications (2h)",Explain the purpose of business records.,mcq,Accurate business records in an RCFE support:,Concealment of operations,"Compliance, financial accountability, and audit readiness",Higher fees only,Avoiding inspections,,B,"Accurate records support compliance, accountability, and audit readiness.",easy,RCFE-CETP-009 LIC 9140 Course Packet,SME review recommended,RCFE/RCFE-CETP-009
RCFE-RCFE-CETP-009-Q02,RCFE,RCFE-CETP-009,"RCFE-CETP-009 - Business Operations, Records, Claim-Safe Communications (2h)",Apply record-retention requirements.,mcq,Records that must be retained should be kept:,As briefly as convenient,For the period and in the manner required by applicable regulation,Only until the next month,Never,,B,Retention follows regulatory requirements; confirm retention periods with SME/legal.,medium,RCFE-CETP-009 LIC 9140 Course Packet,SME/legal review required before submission,RCFE/RCFE-CETP-009
RCFE-RCFE-CETP-009-Q03,RCFE,RCFE-CETP-009,"RCFE-CETP-009 - Business Operations, Records, Claim-Safe Communications (2h)",Define claim-safe communication.,mcq,'Claim-safe' communication in operations generally means:,Making unverified promises,Communicating accurately and avoiding misleading or unsupported claims,Exaggerating services,Hiding information from residents,,B,Claim-safe communication is accurate and avoids misleading or unsupported statements.,medium,RCFE-CETP-009 LIC 9140 Course Packet,SME review recommended,RCFE/RCFE-CETP-009
RCFE-RCFE-CETP-009-Q04,RCFE,RCFE-CETP-009,"RCFE-CETP-009 - Business Operations, Records, Claim-Safe Communications (2h)",Apply accurate marketing/representation.,tf,Marketing and admission materials should accurately represent the services the facility actually provides.,TRUE,FALSE,,,,TRUE,Accurate representation avoids misleading prospective residents.,easy,RCFE-CETP-009 LIC 9140 Course Packet,SME review recommended,RCFE/RCFE-CETP-009
RCFE-RCFE-CETP-009-Q05,RCFE,RCFE-CETP-009,"RCFE-CETP-009 - Business Operations, Records, Claim-Safe Communications (2h)",Protect resident financial records.,mcq,Resident financial records handled by the facility must be:,Combined with facility funds,"Kept accurate, separate as required, and protected from misuse",Shared publicly,Estimated,,B,"Resident funds require accuracy, required separation, and protection. Confirm specifics with SME/legal.",medium,RCFE-CETP-009 LIC 9140 Course Packet,SME/legal review required before submission,RCFE/RCFE-CETP-009
RCFE-RCFE-CETP-009-Q06,RCFE,RCFE-CETP-009,"RCFE-CETP-009 - Business Operations, Records, Claim-Safe Communications (2h)",Apply confidentiality to records.,mcq,Confidentiality of resident and business information requires that information is:,Shared freely,Disclosed only to authorized parties and protected from improper access,Posted online,Discussed publicly,,B,Confidential information is protected and shared only with authorized parties.,easy,RCFE-CETP-009 LIC 9140 Course Packet,SME review recommended,RCFE/RCFE-CETP-009
RCFE-RCFE-CETP-009-Q07,RCFE,RCFE-CETP-009,"RCFE-CETP-009 - Business Operations, Records, Claim-Safe Communications (2h)",Apply claim-safe communication in admissions.,scenario,Scenario: A prospective resident's family asks whether the facility provides a level of skilled care it does not actually offer. The administrator should:,Imply the facility offers it to secure the admission,Accurately describe the services the facility provides and not make unsupported claims,Avoid answering,Promise to add the service without basis,,B,"Accurate, claim-safe communication prevents misrepresentation and protects residents.",hard,RCFE-CETP-009 LIC 9140 Course Packet,SME review recommended,RCFE/RCFE-CETP-009
RCFE-RCFE-CETP-009-Q08,RCFE,RCFE-CETP-009,"RCFE-CETP-009 - Business Operations, Records, Claim-Safe Communications (2h)",Identify sound business practices.,ms,Which support sound RCFE business operations? (Select all that apply.),Accurate financial and operational records,Proper retention of required records,Misleading marketing claims,Confidential handling of sensitive information,,A; B; D,"Accurate records, retention, and confidentiality are sound; misleading claims are not.",medium,RCFE-CETP-009 LIC 9140 Course Packet,SME review recommended,RCFE/RCFE-CETP-009
RCFE-RCFE-CETP-009-Q09,RCFE,RCFE-CETP-009,"RCFE-CETP-009 - Business Operations, Records, Claim-Safe Communications (2h)",Apply records access during inspection.,mcq,"When required records are requested during an inspection, the administrator should:",Refuse,"Provide the required records in an organized, accurate, and timely manner",Provide falsified records,Delay indefinitely,,B,Required records should be provided accurately and timely; falsification is prohibited.,medium,RCFE-CETP-009 LIC 9140 Course Packet,SME review recommended,RCFE/RCFE-CETP-009
RCFE-RCFE-CETP-009-Q10,RCFE,RCFE-CETP-009,"RCFE-CETP-009 - Business Operations, Records, Claim-Safe Communications (2h)",Explain the role of admission agreements.,mcq,"A clear, written admission agreement helps to:",Confuse residents,"Set transparent expectations about services, fees, and terms",Hide fees,Avoid accountability,,B,A clear admission agreement sets transparent expectations.,easy,RCFE-CETP-009 LIC 9140 Course Packet,SME/legal review required before submission,RCFE/RCFE-CETP-009
RCFE-RCFE-CETP-009-Q11,RCFE,RCFE-CETP-009,"RCFE-CETP-009 - Business Operations, Records, Claim-Safe Communications (2h)",Apply record protection.,tf,Backups and protection of important records help prevent loss of required documentation.,TRUE,FALSE,,,,TRUE,Record protection/backups guard against loss of required documentation.,easy,RCFE-CETP-009 LIC 9140 Course Packet,SME review recommended,RCFE/RCFE-CETP-009
RCFE-RCFE-CETP-009-Q12,RCFE,RCFE-CETP-009,"RCFE-CETP-009 - Business Operations, Records, Claim-Safe Communications (2h)",Apply transparent billing practices.,mcq,Fee changes or billing practices should be:,Hidden from residents,Communicated transparently and consistent with the agreement and regulation,Applied without notice,Inconsistent,,B,Fees should be transparent and consistent with the agreement and regulation. Confirm specifics with SME/legal.,medium,RCFE-CETP-009 LIC 9140 Course Packet,SME/legal review required before submission,RCFE/RCFE-CETP-009
RCFE-RCFE-CETP-009-Q13,RCFE,RCFE-CETP-009,"RCFE-CETP-009 - Business Operations, Records, Claim-Safe Communications (2h)",Explain the value of honest communication.,mcq,"Honest, accurate communication with residents and families builds:",Distrust,Trust and supports a defensible operation,Liability only,Confusion,,B,Honest communication builds trust and supports defensibility.,easy,RCFE-CETP-009 LIC 9140 Course Packet,SME review recommended,RCFE/RCFE-CETP-009
RCFE-RCFE-CETP-009-Q14,RCFE,RCFE-CETP-009,"RCFE-CETP-009 - Business Operations, Records, Claim-Safe Communications (2h)",Apply organized recordkeeping.,mcq,Organized recordkeeping systems help the administrator to:,Lose documents,"Locate, maintain, and produce required records efficiently",Avoid compliance,Reduce transparency,,B,"Organized systems support efficient, compliant recordkeeping.",easy,RCFE-CETP-009 LIC 9140 Course Packet,SME review recommended,RCFE/RCFE-CETP-009
RCFE-RCFE-CETP-009-Q15,RCFE,RCFE-CETP-009,"RCFE-CETP-009 - Business Operations, Records, Claim-Safe Communications (2h)",State the course purpose.,mcq,The overall purpose of this course is to:,Provide clinical certification,"Strengthen business operations, recordkeeping, and claim-safe communications in the RCFE",Replace licensing,Eliminate records,,B,"The purpose is sound operations, recordkeeping, and claim-safe communication.",easy,RCFE-CETP-009 LIC 9140 Course Packet,SME review recommended,RCFE/RCFE-CETP-009
